{
  "id": "relation.analyzer-analyzername-uses_entity",
  "source": "Analyzer",
  "target": "AnalyzerName",
  "relationship": "uses_entity",
  "cardinality": "unknown",
  "description": "Analyzer references frontend entity AnalyzerName.",
  "confidence": "medium",
  "evidence": [
    "src\\core\\analyzer.ts"
  ]
}
